<?xml version="1.0" encoding="utf-8"?>
<ModelType version="1.0" xmlns="http://www.arekusu.com" xmlns:xsi="http://www.w3.org/2001/XMLSchema-instance"
           xsi:schemaLocation="Model.xsd">
<DefinitionType rootElement="Transport">
    <EntityType alias="Element">
        <FieldsType schema="TestSchema" table="TestTable">
            <FieldType alias="Field1" column="TestColumn"/>
            <FieldType alias="Field2" column="AnotherTestColumn"/>
        </FieldsType>
        <ReferencesType>
            <EntityType alias="RefElement" sourceField="" destinationField="" />
            <EntityType />
        </ReferencesType>
        <LinksType>
            <EntityType alias="LinkedElement" sourceField="" destinationField="" />
            <EntityType />
        </LinksType>
    </EntityType>
</DefinitionType>
</ModelType>